src,tgt,src_lang,tgt_lang,domain
"Shopping experience is really worse. No. of times the article ordered, first gets delayed and then canceled .Even after talking to the customer service help desk number of times, the only reply from them is ""sorry for the inconvenience cause to you,"" but they do nothing. Once the article was reordered by the customer help desk, it got delayed again and probably might get canceled. Myntra doesn't care about customers. If they dont want to deliver the article, then why do they accept the order.","ஷாப்பிங் எக்ஸ்பீரியன்ஸ் ரொம்ப மோசமா இருக்கு. எத்தனை முறை ஆர்டர் பண்ணினாலும், முதலில் டிலே ஆகுறது, பிறகு கேன்சல் ஆகுறது. கஸ்டமர் கேர் ஹெல்ப்டெஸ்க்-ல பேசினால்  கூட, அவங்களோட ரிப்ளை ஒரே மாதிரியா இருக்கு - 'இன்கன்வீனியன்ஸ்க்கு சாரி'னு சொல்லிதான் முடியும். ஆனா எந்த ஒரு ஆக்ஷனும் எடுக்க மாட்டாங்க! ஒரு தடவை கஸ்டமர் கேர் மறுபடியும் ஆர்டர் பண்ணச் சொல்லி அனுப்பிச்சாங்க... அதுவும் டிலே ஆயிட்டு... இப்போ கேன்சல் ஆகிடும்னு தெரியுது. மிண்ட்ரா கஸ்டமர்ஸ்க்கே கவலையே இல்லை. டெலிவர் பண்ணத்தான் முடியாதுனா, ஆர்டரை ஏன் அசெப்ட் பண்றாங்க?",English,Tamil,F
very bad service and poor service team no support from team and worst ever pls do not shopping from this so called myntra go for flipkart and amazon my 1st and last order never go with it in future will give minus rating if possible,"சபோர்ட் டீம் பிரச்சனைக்கே தீர்வு இல்லை. இந்த மிண்ட்ராவ்ல இனி ஒரு பைசா கூட ஷாப்பிங் பண்ணாதீங்க! ப்ளிப்கார்ட், அமேசான்-ல ஆர்டர் பண்ணுங்க.இதுல நான் விட்ட முதல் ஆர்டரே கடைசி ஆர்டர்! எப்பவுமே இந்த கம்பெனி விஷயத்துல திரும்பப் பார்க்க மாட்டேன்! முடிஞ்சா, மைனஸ் ரேட்டிங் கூட கொடுப்பேன்.",English,Tamil,F
"This is for blocking my account, with out known reasons. Update to world: We have suspended your account, as per the terms mentioned under Clauses 4 and 12 of the Terms of Use listed on the Website and Mobile App. However, please note that any/ all confirmed orders or transactions that you may have placed till date will be duly considered valid and processed. Please note that all/any linked accounts to your primary account, we have terminated those as well.","இது என் கணக்கை எந்த காரணமும் தெரியாம நிறுத்தியதுக்கான பதிலா இருக்கு. உலகம் அறிய:“உங்கள் கணக்கு தற்காலிகமாக நிறுத்தப்பட்டுள்ளது”னு சொல்லி, வெப்சைட் மற்றும் அப்பில இருக்கிற விதிமுறைகளின் கிளாஸ் 4 மற்றும் 12-ன் அடிப்படையிலங்குறது என்று ஒரு வரிசை வார்த்தை.ஆனா, முக்கியமா சொல்லணும் – இதுவரைக்கும் நீங்க போட்ட அனைத்து கான்ஃபர்ம் ஆன ஆர்டர்களும், ட்ரான்ஸாக்ஷன்களும் சரியான முறையிலவே தொடரும். அதோடா, உங்க முக்கிய கணக்கோட இணைந்த இருக்கக்கூடிய மற்ற எந்த linked accounts இருந்தாலும், அதையும் முடிச்சுட்டோம்.",English,Tamil,F
"Bad experience , i ordered a product , and wanted to return the product in same day , but the delivery person marked it as used , but i didnt even opened it, and myntra team denied to return the product, now i am left with a product that i dont ieven want to keep!!","ரொம்ப மோசமான அனுபவம். நான் ஒரு பொருளை ஆர்டர் பண்ணினேன், அந்த நாளே ரிட்டர்ன் பண்ணனும் னு கேட்டேன். ஆனா டெலிவரி பண்ண வந்தவர், நான் திறக்காமலே இருக்கும்போது, “பயன்படுத்திய பொருள்”னு மார்க் பண்ணிட்டார். அதனால மின்த்ரா டீம் ரிட்டர்ன் ஏற்கவே மறுத்துட்டாங்க. இப்போ எனக்கு வேண்டாம்னு நினைக்குற ஒரு பொருளை, நான் கட்டாயமா வைத்திருக்கணும். ரொம்பவே மோசமா இருக்கு",English,Tamil,F
Best eCommerce website for purchasing clothing and footwear.,துணிகளும் காலனிகளும் வாங்க பெஸ்ட் இகாமர்ஸ் வெப்சைட் இதுதான்,English,Tamil,F
"I should give no star if it was possible! Horrible delivery system even after taking such big amount of delivery charge on each item, while competitors like Flipkart and Amazon give that for free. Only the collection good! But so what if a misfit dress takes more than stipulated amount of time period to reach and again 10 more days to take a return that too only if you tolerate the horrible behavior of Delivery guys.. That's just too much!!!!",ஒரு ஸ்டார் கூட கொடுக்க மாட்டேன் ரொம்ப மோசமான டெலிவரி சிஸ்டம் ஒவ்வொரு பொருளுக்கும் நிறைய டெலிவரி சார்ஜ் வசூலிக்கறாங்க ஆனால் ப்ளிப்கார்ட் அமேசான் மாதிரி இவங்க போட்டியாளர்கள் அதை ஃப்ரீயா கொடுக்குறாங்க கலெக்ஷன் மட்டும் தான் நல்லா இருக்கு ஆனா அது போதாது ஒரு சரியான அளவுல உடை நேரம் தாண்டி வந்து சேர்ந்தது என்ன பயன் அதுக்கு பிறகு ரிட்டன் பண்ண 10 நாளா காத்திருக்க வேண்டும் அதுவும் டெலிவரி பாய்சோட கேவலமான நடத்திய வேற தாங்கிக்கணும் இதெல்லாம் ரொம்ப ஓவர்தான்,English,Tamil,F
"Worst product return experience. I have raised a return request since 7+ days. Everyday i receive the item pickup message and in the evening another message appears that item couldn't picked up as I rescheduled it. When i call the person, no one picks up the call. And after some time, the number gets switched off. The contact us feature on site is also not working. Very disappointing.","ரிட்டர்ன் எக்ஸ்பீரியன்ஸே ரொம்ப ரொம்ப மோசம்! 7 நாளா ரிட்டர்ன் ரிக்குவெஸ்ட் போட்டிருக்கேன்!ஒவ்வொரு நாளும் காலையில் ஒரு மெசேஜ் வரும் – ""இன்று உங்கள் பொருள் பிக்கப் செய்யப்படும்"",மாலையில் இன்னொரு மெசேஜ் ""நீங்கள் ரீஷெட்யூல் செய்ததால் பிக்கப் ஆகவில்லை""!ஆனா, நான் எப்பவுமே ரீஷெட்யூல் பண்ணல! அவங்களே தானா ஏமாற்றுறாங்க! கூடவே, டெலிவரி பையனை கால் பண்ணினா எடுக்க மாட்டேங்கறான். கொஞ்ச நேரத்திலேயே நம்பர் ஸ்விட்ச் ஆஃப் ஆயிடும்!சைட்ல இருக்கும் ""Contact Us"" ஆப்ஷனும் வேலை செய்யலை... ஒரே ஏமாற்று! நம்பிக்கையே போச்சு!",English,Tamil,F
"Yeah products are good but services are bad and especially it's customer care services and the offers it provide (which is benefiting them instead of customers ex:- they will show you buy 1 get 1 free but for that u have to buy 1 at it's orginal price which compensates the offer price of both, & not only this i have noticed a lot of things it's just i cannot write all). And if i compare with Amazon or other online site, then those are better than myntra in deals, offers or customers services.","பொருள்கள் நல்லதா இருக்கு, ஆனால் சர்வீஸ் மட்டும் ரொம்ப மோசம்! கஸ்டமர் கேர் சர்வீஸ் எப்படி இருக்குன்னா...அவங்க கொடுக்குற 'ஆஃபர்ஸ்'ன்னு சொல்றதும் ஏமாற்றுதான்! எடுத்துக்கறேன் – ""1 வாங்கினா 1 ஃப்ரீ""னு போடுறாங்க... ஆனா முதல் பொருளை ஃபுல் பிரைஸ்ல வாங்கணும்னு இருக்கு! அதுல அவங்களுக்கே லாபம்... நாம ஏமாந்துடுறோம்! இதுமட்டுமில்ல... இதுபோல எத்தனையோ தந்திரங்களை பண்ணிக்கிட்டு இருக்காங்க, எல்லாம் எழுதினா ஈவினிங் ஆயிடும்...அமேசான், ஃப்ளிப்கார்ட் மாதிரி சைட்ஸ்ல இருந்து வாங்குனா, டீல்ஸ், ஆஃபர்ஸ், கஸ்டமர் சர்வீஸ் எல்லாமே இதுக்கு மேலேதான் இருக்கு!",English,Tamil,F
"[new edit] - I reinstalled the app and was was adding things to wishlist. It fails 95% of the time!!!! If I could five 0 stars, I would!!! Very bad user experience even though the products are good. [Old] - i love the app but right now i am having a bad experience. It is not letting me see my bag. I tried logging out and reinstalling the app. But it is not letting me login either.","புதிய புகார்: ஆப்பை மீண்டும் இன்ஸ்டால் பண்ணி விஷ்லிஸ்ட்ல பொருள்களை சேர்க்க முயற்சி செய்தேன். 95% டைம்ஸ் வேலை செய்யல! 0 ஸ்டார்ஸ் கொடுக்க முடிஞ்சா கூட கொடுத்திருப்பேன்! பொருள்கள் நல்லா இருந்தாலும், யூஸர் எக்ஸ்பீரியன்ஸ் ரொம்ப மோசம்!பழைய புகார்: நான் இந்த ஆப்பை ரொம்ப லவ் பண்ணுவேன். ஆனால் இப்போது என் பையை பார்க்க முடியலே. லாக் அவுட் பண்ணி, ஆப்பை மீண்டும் இன்ஸ்டால் பண்ணி பார்த்தேன். இப்போது லாக் இன் கூட ஆகாமல் இருக்கு!",English,Tamil,F
Worse app. Exchanging product will take lot of time. Some times they won't agree for exchange.. In my case I ordered proline jogger but I received different colour.. nd size.. delivery agent is not picking up my product for exchange .. this happens for me twice... Amazon or flipkart are much better than Myntra... nd I found multiple bugs nd down times for the application. If someone receive wrong product please return it instead of exchange...,"இந்த ஆப் ரொம்ப கெட்டது! எக்ஸ்சேஞ்சுக்கு அனுப்பினா ரொம்ப நாள் பிடிக்கும்! சில சமயம் எக்ஸ்சேஞ்சே கூட அனுமதிக்க மாட்டாங்க!என் விஷயம் பாருங்க - நான் 'ப்ரோலைன் ஜாக்கர்' ஆர்டர் பண்ணினேன், வந்தது வேற நிறம்! வேற சைஸ்! டெலிவரி ஏஜெண்ட் எக்ஸ்சேஞ்சுக்கு வாங்கிக்கிட்டு போக மாட்டேங்கறான்... இப்படி எனக்கு ரெண்டு தடவை நடந்திருக்கு!அமேசான், ஃப்ளிப்கார்ட்ல இந்த மாதிரி பிரச்சனைகள் கிடையாது! இந்த ஆப்பில் ரொம்ப பிழைகள் (Bugs), டவுன்டைம்ஸ் எல்லாம் இருக்கு. யாருக்காவது தவறான பொருள் வந்தால், எக்ஸ்சேஞ்சுக்கு முயற்சி பண்ணாதீங்க... நேரே ரிட்டர்ன் அனுப்பிடுங்க",English,Tamil,F
"The best app I have experienced till now Have tried many others before, sometimes it was okay but many time I got cheated with no chance of exchange and sometimes could not even contact them. But this one is not like that. If you don't like the product, you can exchange it very easily which I think is the best quality of Myntra. And the product quality is always good.","இதுவரை பயன்படுத்தியதிலேயே சிறந்த ஆப் இது! இதுக்கு முன்னாடி வேற எத்தனையோ ஆப்புகளை ட்ரை பண்ணியிருக்கேன்... சில சமயம் ஏதோ பரவாயில்லைன்னு இருந்தாலும், பெரும்பாலும் ஏமாற்றம்தான்! எக்ஸ்சேஞ்ச் கிடைக்காமலும், கஸ்டமர் கேர் கூட காணாமலும் போயிட்டதுண்டு!ஆனா இந்த மிந்த்ரா அப்படி இல்லை! பொருள் பிடிக்கலன்னா, எளிதா எக்ஸ்சேஞ்ச் செய்யலாம்... இதுதான் இவங்களோட பெரிய ப்ளஸ் பாயிண்ட்! அதோடு, பொருள்களின் குவாலிட்டியும் எப்போதுமே நல்லாத்தான் இருக்கு! ரொம்ப ரொம்ப சந்தோஷமா ஷாப்பிங் பண்ண வைக்கிற ஆப்",English,Tamil,F
"Worst ecommerce platform. My order was delayed by them without any reason, and after a lot of follow-ups, I got a message that I will get a delivery date update in next 5 days. Worst, pathetic experience. I'm not going to use this platform; Amazon is far better than this. Pathetic!! I'm canceling my order, but they will refund my money after 10 days.""","இதுவே ஈ-காமர்ஸ் பிளாட்ஃபார்ம்ல மோசமானது! என் ஆர்டரை எந்த காரணமுமில்லாமல் டிலே பண்ணிட்டாங்க! நான் எத்தனையோ முறை ஃபாலோ அப் எடுத்தும், கடைசியா ஒரு மெசேஜ் வந்தது – 'அடுத்த 5 நாட்கள்ல டெலிவரி டேட் அப்டேட் தருவோம்'னு! ஒரே ஏமாற்றம்! வேதனையான அனுபவம்! இந்த பிளாட்ஃபார்ம்ல இனி ஒரு ஆர்டர் கூட போட மாட்டேன்! அமேசான் இதுக்கு எத்தனை மடங்கு நல்லது! என்ன வேடிக்கையோ, நான் ஆர்டரை கேன்சல் பண்ணிட்டேன், ஆனா பணத்தை 10 நாட்களுக்கு பிறகு தான் திருப்பி கொடுப்பாங்களாம்! ஒரே கேவலம்!""",English,Tamil,F
"I've been using myntra since very long. But from last of my three to four experiences that I've had by myntra is very worst! Hope you may work on your returns process so that customers should not suffer for their refunds. The same reason for every refund on hold which is not even justified, it is so disturbing. Returning unused product with all the tags intact in it, then too the return is kept on hold . I don't understand what is the issue!","நான் வெகு காலமா மிந்த்ராவை பயன்படுத்தி வரேன். ஆனால் கடந்த 3-4 ஆர்டர்களின் அனுபவம் மட்டும் ரொம்ப மோசமா இருந்திச்சு! உங்கள் ரிட்டர்ன் ப்ராசஸ்-ல மேம்பாடு வேணும்... கஸ்டமர்ஸ் ரிஃபண்ட் கிடைக்காமல் தவிக்கிற மாதிரி நிலைமை இருக்கக்கூடாது. ஒவ்வொரு முறையும் ரிஃபண்ட் ஹோல்ட்-ல இருக்கு... அதுக்கு காரணம் என்னனு கூட சரியா சொல்ல மாட்டாங்க! பிரயோகிக்காத, டேக்ஸ் கூட அப்படியே இருக்குற பொருளை கூட ரிட்டர்ன் ஹோல்ட் பண்ணுறாங்க! இதுல என்ன பிரச்சனைன்னே புரியல! உண்மையிலேயே மனசுல ஏமாற்றமா இருக்கு",English,Tamil,F
Product sent by myntra is different and i have applied for return so abhi Tak kuch return processed nhi hua. Ab myntra app bekar ho gaya h.... Service is going worst day by day .... They are taking already processing fee still service is poor.. other shopping apps are now better than this... Kindly go towards other shopping app,"மின்த்ரா அனுப்பிய பொருள் தானே வேற மாதிரியானது! அதுக்காக ரிட்டர்ன் ரிக்வெஸ்ட் போட்டுட்டேன், ஆனா இன்னைக்கும் எதுவுமே புராசஸ் ஆகல. இப்போ மின்த்ரா ஆப் கட்டிப்போச்சு போலிருக்கு… சேவை நாளுக்கு நாள் கேவலமாகி கொண்டு இருக்கு. ஏற்கனவே ப்ராசஸ்ஸிங் ஃபீ வாங்கறாங்க, ஆனா சேவையே இல்லாத மாதிரி இருக்கு. இப்போ மற்ற ஷாப்பிங் ஆப்புகள் தான் எவ்வளவோ நல்லா இருக்கு. அதனால, நேரத்தை வீணாக்காம வேற ஆப்புகள்ல தான் ஷாப்பிங் பண்ணணும்",English,Tamil,F
found convenient to search and by best product with high quality,"நல்ல தரமுள்ள பொருட்களை எளிமையா தேடி வாங்குறதுக்கு இது ரொம்ப வசதியானதா இருக்கு. எனக்கு ரொம்ப சிம்பிளா, சரியா இருக்கு.",English,Tamil,F
Worst experience. Bad customer support. Got delivered a wrong item a month ago. Placed almost 30 calls over a period of one month. Every time they promise us that it'll be resolved in a few days time but it won't be. They don't even try to give you a callback as to why the ticket is still not resolved. Literally even tried mailing the ceo. Very poor and unprofessional response from most of the associates I talked to.,"என்னோட வாழ்க்கையில வந்த மிக மோசமான அனுபவம் இது. கஸ்டமர் சப்போர்ட் மிகவும் கேவலமா இருக்கு. ஒரு மாதத்துக்கு முன்னாடி என்னால வாங்கிய பொருள் தப்பானதா டெலிவரி ஆயிருக்கு. அதுக்காக கடந்த ஒரு மாதத்தில் நான் 30 முறை அழைத்திருக்கேன். ஒவ்வொரு முறையும், “ஏற்கனவே டிக்கெட் உருவாக்கியாச்சு, சில நாட்களில் சரி பண்ணிடுறோம்”னு சொல்லுவாங்க – ஆனா அதைத் தொடர்ந்து எதுவுமே நடக்காது. ஒரு கால்பேக் கூட குடுக்க மாட்டாங்க, ஏன் டிக்கெட் இன்னும் சால்வ் ஆகலனு கேட்கவே முடியாது. கூடவே CEO-வுக்கே மெயில் அனுப்பி பார்த்தேன். ஆனாலும், பெரும்பாலான எஜெண்ட்கள் மிகவும் தவறான, புரோஃபஷனல் இல்லாத முறையில நடந்துக்குறாங்க.",English,Tamil,F
I have been a regular user in myntra. But recently its been a headache to use the app. Keeps asking for updates and the screen keeps freezing. And one more thing is that they have disabled COD. It's utterly frustrating as I'm having some trouble paying online. But the least they can do is have COD as well as every app offers it . I won't be using the app anymore as its become really annoying and less user friendly,நாம் மிந்திராவை கடைசி வரை ரொம்ப நம்பி பயன்படுத்தினேன். ஆனால் சமீபமா இந்த ஆப்பை பயன்படுத்துறதுக்கே ஒரு தலைவலியா போயிடுச்சு ஒவ்வொரு முறையும் அப்டேட் கேக்குது ஸ்கிரீன் ஸ்டார்க்  ஆகுது இதுக்கு மேல என்ன கோபம் வருதுனா  கேஷ் ஆன் டெலிவரி ஆர்டரை தடை செய்திருப்பது. எனக்கு ஆன்லைன் பணம் செலுத்துவதில சில பிரச்சனைகள் இருக்கு ஆனா குறைந்தபட்சம் cod வைத்திருக்கலாமே இந்த ஒரு பேசிக் வசதி கூட இல்ல இது மாதிரி இனிமே இந்த ஆப் இருந்தா நான் பயன்படுத்தவே மாட்டேன் ரொம்பவே அலுப்பு குடுக்குற மாதிரி இருக்கு.,English,Tamil,F
