src,tgt,src_lang,tgt_lang,domain
nice camera,நல்ல கேமரா ,English,Tamil,E
screen display brightness is very low .,ஸ்கிரீன் டிஸ்ப்ளே பிரைட்னஸ் கொஞ்சம் கம்மியா இருக்கு,English,Tamil,E
you can not use your phone on sunlight even full brightness .,"
நீங்க உங்க போனை சூரிய வெளிச்சத்துல யூஸ் பண்ண முடியாது ரொம்ப பிரைட் வச்சா கூட",English,Tamil,E
so i decrease 4 to 3 star .,அதனால நான் நாலு ஸ்டாருல இருந்து மூணு ஸ்டார் ரேட்டிங் குறைச்சுட்டேன்,English,Tamil,E
best in the class .,"
அதோட கிளாஸ் பெஸ்ட்",English,Tamil,E
one of d best under 10kp,பத்தாயிரம் ரூபாய்க்கு உள்ளார இருக்குற போன்ல இது பெஸ்ட்,English,Tamil,E
camera and battery back up awesome but in 3gb ram mobile is not satisfied pub-g mobile gameing app,"
ஆக்ரி பேக்க புன் சூப்பர் ஆனா 3gb ரேம் மொபைல் வந்து பப்ஜி கேமுக்கு சப்போர்ட் ஆகல",English,Tamil,E
i m very satisfied with this purchase .,"
இத வாங்குனது எனக்கு ரொம்ப திருப்தியா இருக்கு",English,Tamil,E
this phone is very good as i aspected .,"
இந்த போன் நான் எதிர்பார்த்த மாதிரி ரொம்ப நல்லா இருக்கு",English,Tamil,E
best phone .,"
நல்ல போன்",English,Tamil,E
"camera is awesome , value for money and awesome features .","கேமரா ரொம்ப நல்லா இருக்கு ,விலைக்கு ஏத்த பொருள் ரொம்ப நல்ல ஃபீச்சர்ஸ்",English,Tamil,E
"one day backup , fast charge in 65 minutes",ஒரு நாள் பேக்கப் ஃபாஸ்ட்டா சார்ஜ் ஆயிடும் 65 மினிட்ஸ்ல,English,Tamil,E
mind blowing features in this phone,"
ரொம்ப சிறப்பான ஃபீச்சர்ஸ் இந்த போன்ல இருக்கு 
",English,Tamil,E
awesome best camera phone in this budget best performance,"
ரொம்ப நல்ல கேமரா ஃபோன் இந்த பட்ஜெட்ல ரொம்ப நல்ல பர்பாமென்ஸ்",English,Tamil,E
good handset,"
நல்ல போன்",English,Tamil,E
very very nice product,ரொம்ப ரொம்ப நல்ல ப்ராடக்ட்,English,Tamil,E
value for money phone .,"
விலைக்கு ஏத்த நல்ல போன்",English,Tamil,E
portrait mode is good .,"
போர்ட்ரைட் மோடு ரொம்ப நல்லா இருக்கு
",English,Tamil,E
macro lens is also goodselfie camera is on pointperformance wise this phone is a beast .,மேக்ரோ லென்ஸ் நல்லா இருக்கு செல்ஃபி கேமரா நல்லா இருக்கு பாயிண்ட் பர்பாமன்ஸ் வாய்ஸ் வந்து இந்த போன் ரொம்ப ரொம்ப நல்லா இருக்கு,English,Tamil,E
but ultimately it depends on usage .,"
ஆனா இது கண்டிப்பா உபயோகப்படுத்துறத பொறுத்தது
",English,Tamil,E
if used lightly the phone cn run more than 1 . 5 days .,"
கொஞ்சம் கம்மியா யூஸ் பண்ணுனா குறைஞ்சபட்சம் ஒன்றரை நாள் வரைக்கும் பேட்டரி இருக்கும்
",English,Tamil,E
if used heavily then the phone can go for 12 hoursall in all its the best deal .,இந்த போன ரொம்ப யூஸ் பண்ணா கூட 12 ஹவர்ஸ் பேட்டரி நீக்கும் இதுதான் பெஸ்ட் டீல்,English,Tamil,E
go for it,"
இதை வாங்கலாம்",English,Tamil,E
overall good mobile in this range .,"
நல்ல மொபைல் இந்த ரேஞ்சுல
",English,Tamil,E
value for money .,"
பணத்துக்கு ஏத்த மதிப்பு",English,Tamil,E
camera is a monster .,கேமரா ஒரு மான்ஸ்டர்,English,Tamil,E
faster refresh rate .,"
ஃபாஸ்டான ரெப்ரெஷ் ரேட்",English,Tamil,E
best budget phone,"
நல்ல பட்ஜெட் போன்",English,Tamil,E
nice one .,"
நல்ல போன்",English,Tamil,E
in d budget,"
பட்ஜெட்ல இருக்கு 
",English,Tamil,E
superb .,"
சூப்பர்",English,Tamil,E
crazy phone it is really ossum,வித்தியாசமான போன் ரொம்ப நல்லா இருக்கு,English,Tamil,E
best phone in this price range .,"
இந்த பிரைஸ் ரேஞ்சில பெஸ்ட் போன்",English,Tamil,E
1 . cameras are awesome i &apos;m adding some shots from this phone .,"
கேமரா ரொம்ப நல்லா இருக்கு  இந்த போன்ல எடுத்து கொஞ்சம் போட்டோ ஷேர் பண்ற",English,Tamil,E
so no issues with battery performance 5 . design is awesome all-over a perfect phone at this price .,"
பேட்டரி பெர்பாமன்ஸ்ல எந்த பிராப்ளம் இல்ல டிசைன் ரொம்ப நல்லா இருக்கு மொத்தமா இந்த போன் இந்த ப்ரைஸுக்கு ரொம்ப நல்லா இருக்கு. 
",English,Tamil,E
just go for it,"
எதுவும் யோசிச்சுக்காம வாங்கிக்கலாம்
",English,Tamil,E
love the phone awesome camera quality,"
எனக்கு இந்த போன் ரொம்ப புடிச்சிருக்கு கேமரா குவாலிட்டி ரொம்ப நல்லா இருக்கு",English,Tamil,E
i am a make up artist .,நான் ஒரு மேக்கப் ஆர்டிஸ்ட்,English,Tamil,E
now not need to any photographer,"
எனக்கு இப்ப எந்த போட்டோகிராபரும் தேவையில்லை
",English,Tamil,E
nice but over saturated,"
நல்லா இருக்கு ஆனா ரொம்ப மிகைப்படுத்தி சொல்றாங்க",English,Tamil,E
"great camera super performance ,","
கேமரா ரொம்ப நல்லா இருக்கு சூப்பர் பர்ஃபார்மன்ஸ்",English,Tamil,E
awesome quad camera quality &amp; amp ; speed performance is to good well done realme,"
quad கேமரா குவாலிட்டி ரொம்ப நல்லா இருக்கு ஸ்பீட் பெர்ஃபார்மன்ஸ் ரொம்ப நல்லா இருக்கு வெல்டன் ரியல் மீ 
",English,Tamil,E
"the device has simply left me stunned , it simply stunned me with its smooth performance and beautiful design .",இந்த டிவைஸ் இதோட ஸ்மூத் பர்பாமன்ஸ் மற்றும் பியூட்டிஃபுல் டிசைன்ல  என்னய  மெய் மறக்க வச்சிடுச்சு,English,Tamil,E
i was too excited to capture moments with that 48 mp x 4 quad camera along with macro and portrait lenses adding to the complete experience .,"இந்த 48MP x 4 குவாட் கேமராவோடு மேக்ரோ, போர்ட்ரெயிட் லென்ஸ்களும் சேர்ந்து அடடே... ஷாட்களை எடுக்கும்போதே ரொம்ப ரொம்ப எக்ஸைடட் ஆகிட்டேன்! ஒரே ஒரு க்ளிக்-லே எல்லா அனுபவமும் காம்ப்ளீட் ஆயிடும்",English,Tamil,E
"vooc 20w is better than vooc 3 . 0 ( 20w &amp; gt ; 18w ) , the fastest charging phone at this price .","vooc 3 . 0 ( 20w &amp; gt ; 18w ) , விடvooc 20w தான் பெட்டெர் ஆன போன்.ரொம்ப விரைவா சார்ஜ் ஆகுற போன்.",English,Tamil,E
i recommend this device to all,"
இந்த போன நான் எல்லாத்துக்கும் ரெக்கமண்ட் பண்றேன்",English,Tamil,E
awesome phone,"
சூப்பர் போன்",English,Tamil,E
"nice phone , i like it soo much .","
நல்ல போன் எனக்கு ரொம்ப ரொம்ப பிடிச்சிருக்கு
",English,Tamil,E
guys go for it without any doubt .,"
எல்லாரும் எந்த சந்தேகமில்லாமல் கண்டிப்பா வாங்கலாம்",English,Tamil,E
wonderful camera,"
பிரமாதமான கேமரா",English,Tamil,E
thise is a normal selfie .,"
இது நார்மலான ஒரு செல்பி",English,Tamil,E
very satisfying .,"
ரொம்ப திருப்திகரமா இருக்கு
",English,Tamil,E
performance is best .,பெர்ஃபார்மன்ஸ் ரொம்ப நல்லா இருக்கு,English,Tamil,E
phone is overall value for money .,"
போன் வாங்கின விலைக்கு ரொம்ப நல்ல போன்",English,Tamil,E
love it too much,"
எனக்கு ரொம்ப புடிச்சிருக்கு",English,Tamil,E
i nice ph with great budget,"
நல்ல விலையில் சிறப்பான ஃபோன்",English,Tamil,E
awesome phone,"
ரொம்ப நல்ல போன் 
",English,Tamil,E
excellent phone,சிறப்பான போன்,English,Tamil,E
"superb camera quality , fast charging almost in half an hour it &apos;s % i &apos;m in love with this mobile .","சூப்பர் கேமரா குவாலிட்டி, அரைமணில சார்ஜ் ஆகுற ஃபாஸ்ட் சார்ஜிங்,எனக்கு இந்த மொபைல் புடிச்சிருக்கு  ",English,Tamil,E
phone of d year 2019 .,"
2019ல் சிறந்த போன்
",English,Tamil,E
the beast,பெஸ்ட் போன் ,English,Tamil,E
amazing camera result and overall is very good phone,சிறப்பான கேமரா ரிசல்ட் மொத்தமா இது ஒரு நல்ல போன்,English,Tamil,E
awesome,சூப்பர் ,English,Tamil,E
excillent i am using this phone .,"
இந்த போன்ன நான் யூஸ் பண்ற ரொம்ப அருமையா இருக்கு
",English,Tamil,E
believe me you never regret .,"
என்னை நம்புங்க நீங்க வருத்தமே பட மாட்டீங்க",English,Tamil,E
it is a beast,இது பயங்கரமான போன் ,English,Tamil,E
"trust me it best for gaming , i played 2 hours of pubg and just 20 % drained out .",கேமிங் க்கு செம போன் இது ரெண்டு மணி நேரம் பப்ஜி விளையாடியும் 20% தான் பேட்டரி குறைந்தது,English,Tamil,E
very nice phone very smooth display and very performance,அருமையான பெர்ஃபார்மன்ஸ் ஓட ஸ்மூத் டிஸ்ப்ளே இருக்கிற சூப்பர் போன்,English,Tamil,E
"display is so smooth , first impression is amazing and 8 / 128 gb is to amazing if you are thinking to buy you should definitely",அருமையான டிஸ்ப்ளே முதல்ல பார்க்கும்போதே அட்டகாசமா இருக்கு 8 \128 ஜிபி அமேசிங் இது வாங்கணும்னு நினைச்சா கண்டிப்பா வாங்கிடுங்க.,English,Tamil,E
absolutely value for money .,பணத்துக்கேத்த மதிப்பு,English,Tamil,E
delivery was on time and phone is working very good .,கரெக்ட் டைம்  டெலிவரி போன் நல்ல வேலை செய்து,English,Tamil,E
best phone in this range .,இந்த ரேஞ்சுல பெஸ்ட் போன்,English,Tamil,E
thanks flipkart,தேங்க்ஸ் flipkart ,English,Tamil,E
one of the most perfect smartphone available at this price in india # realme 6,இந்த விலையில இந்தியால விக்கிற பர்ஃபெக்ட் ஸ்மார்ட் போன்# ரியல் மீ 6,English,Tamil,E
the camera is on top notch .,அடிச்சுக்க முடியாத கேமரா,English,Tamil,E
no questions about that .,"
எந்த கொஸ்டினும் இல்ல இத பத்தி",English,Tamil,E
the quality of every picture is great .,பிச்சர் குவாலிட்டி அருமையா இருக்கு ,English,Tamil,E
video is best .,பெஸ்ட் வீடியோ ,English,Tamil,E
phone display is very nice .,போன் டிஸ்பிலே ரொம்ப நல்ல இருக்கு ,English,Tamil,E
performance is excellent .,பெர்ஃபார்மன்ஸ் அட்டகாசம்,English,Tamil,E
the price is a bit high .,விலை கொஞ்சம் அதிகம் ,English,Tamil,E
excellent phone .,அருமையான போன் ,English,Tamil,E
"best phone at this rang with 8 gb ram , i have read some of review they just lie yes yes they just lie there is a option for battery percentage as you can see it in image",இந்த ப்ரைஸ்ல இந்த ஸ்பெக் குடுக்கிற இவ்ளோ நல்ல போன் வேற எதுவும் இல்லை டா! ரிவ்யூ படிச்சு மட்டும் விடாதீங்க... நான் சொல்றத நம்புங்க,English,Tamil,E
nyc phone,நல்ல போன் ,English,Tamil,E
after using 15 days * * * * * pros : 1 . charging : best feature of this phone is 30 watt vooc 4. o charging .,"15 நாள் யூஸ் பண்ணப்பறோம் போன் நல்லவை :சார்ஜிங் ,இந்த போன் பெஸ்ட் விஷயம் 30வாட் vooc சார்ஜிங் ",English,Tamil,E
5 / 5it just takes 50 minutes to charge the phone from from 0 to 100 % .,5\5  இந்த போன் 100% சார்ஜ் ஆக 50 நிமிஷம் தான் ஆகுது.,English,Tamil,E
no tension .,டென்ஷன் இல்ல ,English,Tamil,E
2 . camera : camera is brilliant in daylight .,2. பகல் வெளிச்சத்துல கேமரா அருமையா இருக்கு.,English,Tamil,E
it captures each and every details of the object .,ஒரு பொருள்கூட எல்லா அம்சங்கங்களையும் அருமையா பதிவு செய்யுது ,English,Tamil,E
but pics are extremely punchy and has a yellow tint .,போட்டோஸ் ரொம்ப ஓவர்-பஞ்ச் ஆகி இருக்கு... அதுக்கு மேல யெல்லோ டிண்ட் கூட வந்துட்டு இருக்கு,English,Tamil,E
64 mp camera captures amazing photo in day light .,64 mp கேமரா பகல் வெளிச்சத்துல அட்டகாசமான போட்டோஸ் குடுக்குது ,English,Tamil,E
but camera struggles a bit in the night .,ஆனா இரவு நேரத்துல கேமரா நல்ல குவாலிட்டி குடுக்க கஷ்டப்படுது ,English,Tamil,E
night pictures are not as expected .,இரவு நேர போட்டோஸ் எதிர்பார்த்த அளவு இல்ல ,English,Tamil,E
camera .,கேமரா ,English,Tamil,E
great phone with budget price,பட்ஜெட் வேலையில செம்ம போன் ,English,Tamil,E
thanks for the fastest delivery flipkart .,விரைவான டெலிவெரிக்கு பிளிப்கார்ட்க்கு தேங்க்ஸ் ,English,Tamil,E
it &apos;s a great phone with beautiful camera and battery bt its ultra macro mode its not so gd,"இந்த போன் ஒவரால் ரொம்ப நல்லா இருக்கு! கேமரா அழகா இருக்கு, பேட்டரி பெர்சார்மன்ஸும் ஜோரா இருக்கு... ஆனா அல்ட்ரா மேக்ரோ மோட் மட்டும் கொஞ்சம் weak-ஆ இருக்கு!",English,Tamil,E
excellent mobile .,அருமையான மொபைல் ,English,Tamil,E
worth for your money .,உங்க பணத்துக்கு ஏத்த மதிப்பு.,English,Tamil,E
5 star rating mobile .,5 ஸ்டார் மதிப்பு இருக்குற மொபைல் ,English,Tamil,E
awesome performance .,அட்டகாசமான பெர்ஃபார்மன்ஸ் ,English,Tamil,E
sexy blue color .,அசர அடிக்கும் நீல கலர் ,English,Tamil,E
looking forward to further checks .,இன்னும் நெறய பார்க்க ஆர்வமா இருக்கு ,English,Tamil,E
this phone deserves a 5 star rating at this price .,இந்த விலைக்கு 5ஸ்டார் ரேட்டிங் கு தகுதியான போன்.,English,Tamil,E
"2 . the 30w vooc charger is insanely fast , can charge the phone from 0 % -68 % within 30 mins .",30வாட் சார்ஜிங் இருக்குற வெறித்தனமான போன் 0%ல இருந்து 68%க்கு 30 நிமிஷம்ல சார்ஜ் ஆகிடும் ,English,Tamil,E
something which is not available in the market for .,மார்க்கெட் ல கிடைக்காதது ,English,Tamil,E
nice,நைஸ் ,English,Tamil,E
"this is the best handset in this range , camera , display and battery are super .","இந்த ரேஞ்சுல  சிறந்த ஹண்ட்ஸேட் இதான். டிஸ்பிலே ,பேட்டரி, கேமரா எல்லாமே சூப்பர் ",English,Tamil,E
this is truly a flagship phone in this range .,இந்த போன் தான் எல்லாத்துக்கும் மேல இருக்கு இந்த ரேஞ்சு ல.,English,Tamil,E
"this is my 5th realme device from flipkart before this i purchased 3 realme 2 pro last year and a x 2 months ago , thanks for fast delivery to remote locations also as well as cities .","இது என் 5-வது ரியல்மே டிவைஸ்! இதுக்கு முன்னாடி 3 ரியல்மே 2 ப்ரோ, கடந்த 2 மாதத்தில ஒரு X... எல்லாம் ஃப்ளிப்கார்ட்ல தான் வாங்கினேன்!ரிமோட் லொகேஷன்ஸ்ல கூட ரெகுலர் சிட்டிகள் மாதிரி ரொம்ப ஃபாஸ்ட் டெலிவரி...  ",English,Tamil,E
"friends don &apos;t go for negative reviews , only listen to what your heart says , this is the best phone i ever used .",மச்சி நெகடிவ் கமெண்ட்ஸ் லாம் பார்க்காதீங்க உங்க மனசுக்கு என்ன தோணுதோ செய்யுங்க இதுவர நான் யூஸ் பண்ண போன்லயே இதன் பெஸ்டு ,English,Tamil,E
it is a value for money product .,காசுக்கேத்த மதிப்புள்ள பொருள் ,English,Tamil,E
all things of phone are awesome .,இந்த போன்ல இருக்குற எல்லாமே அட்டகாசம் தான் ,English,Tamil,E
this device is simply awesome .,இந்த போன் சூப்பர் ,English,Tamil,E
worth every penny .,குடுத்த ஒவ்வொரு காசுக்கும் மதிப்பு ,English,Tamil,E
camera quality is superb .,கேமரா குவாலிட்டி சூப்பர் ,English,Tamil,E
don &apos;t think just buy it superb camera quality fast charging good battery backup powerful processor value for money,"எண்ணாதே... வாங்கிடு கேமரா குவாலிட்டி,  ஃபாஸ்ட் சார்ஜிங்,பேட்டரி, பேக்அப் ப்ராசசர் பவர்,இந்த ரேஞ்ச்ல இது மாதிரி போன் வேறே கிடைக்காது",English,Tamil,E
"picture quality and 32mp front camera , 30w fast , mobile wait , charger , battery , backup , performance , internet speed , face lock and fingerprint fast working , and super amoled display really so much better or video stabilization good working ( all good ) / ( i am full satisfied ) thanks realme",,English,Tamil,E
great cameras .,கிரேட் கேமரா ,English,Tamil,E
its a good product .,இது நல்ல ப்ரோடுக்ட் ,English,Tamil,E
camera is awesome .,அட்டகாசமான கேமரா ,English,Tamil,E
i really like this ph .,எனக்கு இந்த போன் நிஜமாவே பிடிச்சிருக்கு ,English,Tamil,E
good phone with high features and i really liked it .,அதிக ஃ பீசர்ஸ் இருக்குற இந்த போன் எனக்கு பிடிச்சிருக்கு ,English,Tamil,E
superb camera and fasting charging incredible .,சூப்பர் கேமரா பாஸ்ட் சார்ஜிங் மொத்ததுல செம்ம ,English,Tamil,E
outstanding .,அவுட்ஸ்டாண்டிங் ,English,Tamil,E
love it,ரொம்ப பிடிச்சிருக்கு ,English,Tamil,E
awesome product,அட்டகாசமான ப்ரோடுக்ட் ,English,Tamil,E
nice phones super,நல்ல போன் சூப்பர் ,English,Tamil,E
very nice phone good camera best battery backup fast charging,"நல்ல கேமரா அருமையான பேட்டரி பேக்கப், பாஸ்ட் சார்ஜிங் இருக்குற நல்ல போன் ",English,Tamil,E
excellent features with reasonable price .,மதிப்பான விலையில அருமையான ஃ பீச்சர்ஸ். ,English,Tamil,E
i love this mobile .,எனக்கு இந்த போன்  பிடிச்சிருக்கு ,English,Tamil,E
impressed with the phone .,இந்த போனால் ஈர்க்கப்பட்டேன் ,English,Tamil,E
great product,கிரேட் ப்ரோடுக்ட் ,English,Tamil,E
the back camera is just crazy as hell,இதோட பாக் கேமரா பயங்கரமா இருக்கு ,English,Tamil,E
best smart phone @ very low price must buy,"கொறஞ்ச வெலைல பெஸ்ட் ஸ்மார்ட் போன்,கண்டிப்பா வாங்கலாம் ",English,Tamil,E
there is performance mode where you can adjust to save battery power - i &apos;m using this at high performance and i get 1 day use perfectly .,இதுல இருக்குற பர் ஃ போர்மன்ஸ் மோட் அட்ஜஸ்ட் செஞ்சு இதன் பேட்டரி பவர் ஜாஸ்தி செஞ்சா சார்ஜ் பண்ணாம ஒரு நாள் கண்டிப்பா வெச்சுக்கலாம் ,English,Tamil,E
no lag happened yet .,இதுவரை lag ஆகல ,English,Tamil,E
23 / 12 / 2019 : : after a day of use : this phone is perfectly valued for money spent .,23\12\19. ஒரு நாள் யூஸ் பண்ணதுல இது பணத்திற்கு ஏற்ற மடிப்புன்னு தெரிஞ்சுது ,English,Tamil,E
this is best at this price range .,இந்த விலைல இதான் பெஸ்ட் ,English,Tamil,E
drawbacks of this phone : -camera has .,இந்த போன்ல  ஒரு குறைபாடுனா அது கேமரா  ,English,Tamil,E
