src,tgt,src_lang,tgt_lang,domain
"If you buy a product and doesn't fit, you can return, next day they will pick the item but you will never get refund. It's been one month now chasing for refund but no response. Lost my money on this pathetic app. They don't call back and close the issue on the app without resolving. None of the ivr option will connect you to Customer care executive. Pathetic service from myntra team. Uninstalling the app and switching to Amazon fashions as they have better service and products.","ஒரு பொருள் வாங்கி உங்களுக்கு பொருந்தலன்னா, ரிட்டர்ன் பண்ண முடியும் – அடுத்த நாளே பிக்கப்பும் நடக்குது.ஆனா அதுக்கப்புறம்? ரீஃபண்ட் கிடைக்கவே கிடைக்காது.ஒரு மாதமா நா தொடர்ந்தா கூட, எந்த பதிலும் இல்ல.பணம் போயிடுச்சு இந்த பத்தேத்தான் ஆப்பால.அவங்க கால் பாக் பண்ணவே மாட்டாங்க,ஆப்புல ""issue resolved""ன்னு மூடிடுறாங்க – எதுவுமே தீராம. IVR-ல எந்த ஆப்ஷன் try பண்ணாலும் கஸ்டமர் கேர் எக்ஸிக்யூட்டிவ்-க்கு connect ஆகவே முடியாது.மின்த்ரா டீம்-ல இருந்து ரொம்ப மோசமான சேவை.இந்த ஆப்பை uninstall பண்ணுறேன். இனிமேல் Amazon fashions தான் – நல்ல சேவையும், நல்ல பொருட்களும் இருக்குது.",English,Tamil,F
Just a glitch that when I am operating the app then suddenly after sometime a white screen comes up and then nothing happens until I press back and when I press back button it takes me to my phone's homescreen and then again I have to open the app and get back to where I was or what I was searching. Hope you guys will pay attention to this thing.,"ஒரே சின்ன பக் தான் – ஆப்பை பயன் படுத்திட்டு இருந்தப்போ திடீர்னு வெள்ளை screen வந்துடுது.
அதுக்கப்புறம் எதுவுமே நடக்கல.பின்னாடி பட்டன் அழுத்தினா homescreen-க்கு போயிடுது.மீண்டும் மறுபடியும் ஆப்பை open பண்ணி, நான் தேடின இடத்துக்கு போகணும். இந்த விஷயத்த கவனிக்கீங்கன்னா நல்லா இருக்கும்.",English,Tamil,F
"It has gotten worse and worse I have ordered the same product twice. Both the times my delivery attempt failed. Last time it got cancelled too automatically. I RECEIVED NO CALL FROM ANY AGENT ABOUT THE DELIVERY. The item gets shipped but not delivered. And I have to wait a full week in order to see the status. If my product was not available in this area, I should not have been allowed to place order. The same thing being repeated again and again is not done. there is no way to call an agent.","இது நாளுக்குநாள் மோசமா போயிட்டு இருக்கு. ஒரே பொருளை இரண்டுமுறை ஆர்டர் பண்ணேன். இரண்டுதவையும் டெலிவரி தோல்வி.கடைசியா ஆர்டரே ஆட்டோமேட்டிக் கான்சல் ஆகிட்டுச்சு.
ஒரு எஜென்ட்டூ கூட call பண்ணல.பொருள் ஷிப் ஆகுது, ஆனா டெலிவரி கிட்ட வரவே மாட்டாங்க.
அதுக்கு ஒரே வாரம் காத்திருக்கணும் status தெரிஞ்சுக்க.இந்த பகுதியில் பொருள் டெலிவரி செய்ய முடியலன்னா, ஆர்டர் itself பண்ண முடியாத மாதிரி இருக்கணும். ஒவ்வொரு தடவையும் இதே மாதிரி நடக்கறது அப்படியே போயிடல.மேலா, எதுக்குமே ஒரு கஸ்டமர் கேர் எஜென்ட்டோட கால்ல் ஆப்ஷனே இல்ல.ரொம்பவே கஷ்டம்.",English,Tamil,F
I always face issue with payments. My payments never go through at first attempt. My paymets are always deducted from my bank accounts and the order is never confirmed there is always an error. I have to always place order second time then only my order is confirmed. And it takes such a long time for the amount to be credited back to the bank account.,"எப்போதும் பெமென்ட்  பண்ணும்போது தான் பிரச்சனை.முதலாவது முயற்சிலே யாராச்சும் பெமென்ட் போகவே போகாது.எங்க அக்கௌன்ட்லிருந்து பணம் கடன் ஆகுது, ஆனா ஆர்டர்  கண்பார்ம் ஆகவே மாட்டேங்குது.எப்போதுமே இரண்டாவது முறையில தான்  ஆகுது.பின், முதலில் கழிச்ச பணம் bank-க்கு திரும்ப credit ஆகறதுக்கு ரொம்ப நேரம் ஆகுது. இது ஒவ்வொரு தடவையும் நடக்கறது ரொம்பவும் சிரமமா இருக்கு.",English,Tamil,F
Amazing appp always first choice... Quality product except sometimes,"அருமையான ஆப், எப்போமே எனோட முதல் விருப்பம்!தரமா பொருட்கள் கிடைக்குது… சில சமயத்தில் மட்டும் கொஞ்சம் குறைவா இருக்கலாம்.மொத்தத்தில சொன்னா நல்ல அனுபவம்!",English,Tamil,F
One of the worst plateform for online shopping. They themselves delayed the order and dont even update the customer regarding this. They offer the delivery date around 12 days and after 12 days they request some more time for delivery............ Overall a useless app. Very disappointed by the service of this app.,"ஆன்லைன் ஷாப்பிங்குக்கு இது போறமாட்டேங்கற ஒரே மோசமான ஆப்.ஓரே ஒழுங்கே இல்லாமே order தாமதப்படுத்துவாங்க.12 நாளுக்கு delivery சொல்லுவாங்க, ஆனா 12 நாள் ஆனப்புறமும் மீண்டும் சாமதானம் கேட்டுக்கிறாங்க.கஸ்டமர்கிட்ட எந்த update-ஊ இல்ல.மொத்தத்தில ஒரு பயனில்லாத ஆப். சேவையால ரொம்பவே வருத்தம்.",English,Tamil,F
"I wanted to return. I raised only one issue, I requested Pick-up, please pick up. That's the only thing I wanted. Every time I'm calling, someone smart there is creating multiple messages, notifications that I receive, he/she hangs up saying issue will be resolved. Then next days again I receive messages, notifications of those pseudo/dummy issues being resolved. But nothing moves on ground. No one shows up for pick up. The process has been repeated for 4 times now. I'm fed up their customer sup","நான் ஒரே ஒரு விஷயம் தான் கேட்டேன் ரிட்டர்ன் பண்ணனும்,பிக்கப் வரணும்.அதுக்காகதான் ரிக்வஸ்ட் போட்டேன்.ஆனா ஒவ்வொரு முறையும் கால்  பண்ணும்போது, அங்க இருக்கிறவங்க தான் ஸ்மார்ட், பல மெசேஜ் ,நோட்டிபிகேஷன்  எடுத்து போடறாங்க.பிறகு கால் கட்  பண்ணி ""இஸ்ஸு ரிசால்வ்  ஆகும்""னு சொல்லுவாங்க.அடுத்த நாள் அந்த போலி மெஸேஜிங்க, டம்மி  இஸ்ஸு ரிசால்வ்  ஆகும் ஆகிறதாம்.ஆனா தரையில எந்த வேலையும் நடக்கல. Pick-upக்கு யாருமே வரமாட்டேங்க.இந்த circus நாலாவது தடவ நடந்துருக்கு.அவங்களோட customer supportல நாவே விட்டு இருக்கேன்.",English,Tamil,F
"Worst app, Not any better way to save time and communicate with customer care in case of any issue. 🤬🤬🤬","மோசமான ஆப்! ஒரு பிரச்சனையாவது வந்தா,கஸ்டமர் கேர் கூட பேச எதுவுமே நேர்த்தியான வழி இல்ல.நேரம் மிச்சப்படுத்தணும்னாலும் முடியல, பிரச்சனை சொல்லணும்னாலும் முடியல. 😡🤬",English,Tamil,F
They use cheap tactics in shipping. Like a charge 79 rupees in low price items . Why . People wait for low price so they can buy there's favourite.Then they start asking shipping charge .,இவங்களோட ஷிப்பிங் எல்லாம் ரொம்ப சீப்பான தந்திரமா இருக்கும் கம்மி விலையில் இருக்கிற பொருட்களெல்லாம் 79 ரூபாய் ஷிப்பிங் கட்டுனமா கேக்குறாங்க மக்கள் குறைத்த விலைக்காக காத்திருக்கிறார்கள் என்று நினைத்து ஆனால் இந்த மாதிரி ஏமாற்றம் தான் விலை கம்மி ஷிப்பிங் சார்ஜ் ஜாஸ்தி,English,Tamil,F
"Terrible encounter! I had requested a return,and the pick-up agent checked all the tags before taking it. The following day, I learned that my refund request had been denied because the tags were missing. When I called their worthless customer service, they advised me to wait for the product to be reshipped before filing a complaint for review. I've been waiting for the thing that I don't want for the past three days. I only get the runaround. They don't deliver on the promises made in their ads","
ரொம்ப மோசமான அனுபவம். நான் ரிட்டன் கேட்டேன் பிக்கப் ஏஜென்ட் வந்து டேக் எல்லாம் பாத்துட்டு எடுத்துட்டு போய்ட்டாங்க.அடுத்த நாள் ரீபண்ட் வரல கேட்ட டாக் இல்லன்னு சொல்றாங்க. கஸ்டமர் காலுக்கு பண்ணினா புதுசா ப்ராடக்ட் வந்ததுக்கு அப்புறம் தான் கம்ப்ளைன்ட் கொடுங்கன்னு சொல்லுறாங்க. மூணு நாள் ஆச்சு நான் வேண்டாத பொருளுக்கு தான் காத்திருக்கேன். இந்த விளம்பரத்தில் சொல்றதெல்லாம் பொய், நிஜத்துல ஒண்ணுமே நடக்கல. ரொம்ப சுத்த விடுறாங்க!
",English,Tamil,F
"Products are good & genuine, but customer service is very bad, really very bad. They don't even have email id for customer service. You always have to relay on their paid phone service; yes exactly that is not toll free.   I have 5-6 times on their on their number but unable connect any customer executive. Placed return request.It has been 1 week, and i'm still waiting for pickup guy to come & pick up the item.  Really i hate the myntra for its service.","
பொருட்கள் நல்லாத்தான் இருக்கு.உண்மையானது தான், ஆனா கஷ்டமர் சர்வீஸ்? கஷ்டமர் கேருக்கு மெயில் கூட இல்லை.பெய்ட் கால்தான் ஃப்ரீயே இல்லை. அஞ்சுல ஆறு முறை கால் பண்ணினா கூட ஏஜென்ட் காண்டாக்ட் பண்ண முடியல. ரிட்டன் ரிக்வெஸ்ட் போட்டேன் ஒரு வாரம் ஆச்சு, இன்னும் யாரும் பிக்கப்புக்கு வரல. சர்வீஸ் பார்த்தா ரொம்பவே கோவமா வருது இதனால தான் மிந்த்ரா மேல வெறுப்பே வந்துருச்சு.
",English,Tamil,F
"I have been a loyal customer of Myntra since many years. But now the experience is not the same anymore. I placed a return request 10-12 days earlier for a purchase, which was cancelled from your end 2-3 times, still I replaced it, but none of your delivery agents is picking it up. I also tried reaching your customer care support system through messages & calls, but I got absolutely no response. I never expected this out of myntra. Highly disappointed!","
நான் பல வருஷமா மிந்த்ராவ உபயோகிக்கிற பழைய வாடிக்கையாளர் தான். ஆனால் இப்போ ஒன்னும் சொல்லிக்கிற மாதிரி இல்ல. 10- 12 நாள் முன்னாடி ரிட்டர்ன் கேட்டிருந்தேன். ரெண்டு மூணு தடவை நீங்க தான் கேன்சல் பண்ணீங்க, அதுக்கப்புறம் மீண்டும் ரிக்வெஸ்ட் போட்டேன் ஆனா இன்னும் டெலிவரி ஆளு  வந்து எடுத்துக்கல. கஸ்டமர் கேர்க்கு  மெசேஜும் காலும் பண்ண, எதுவும் ஒழுங்கான ரெஸ்பான்ஸ் இல்ல. மிந்த்ராவில் இருந்து இப்படி நடக்கும்னு நான் எதிர்பார்க்கவே இல்லை ரொம்ப மோசமான அனுபவம்.
",English,Tamil,F
worst of all the shopping apps. I bought a product from them and then refunded it because of size problems...the delivery guy took the product and after few days I saw that my return request is declined.. when I contacted the customer service they said they have not yet received the product... it has been 4 months and my refund issue is not yet resolved.. Worst app,"
எல்லா ஷாப்பிங் ஆப்பை விட இதுவே ரொம்ப மோசமானது. ஒரு பொருள் வாங்கின சைஸ் பிரச்சனையால ரிட்டன் பண்ணினேன். டெலிவரி ஆளு வந்து எடுத்துட்டாரு ஆனா சில நாள்ல தான் பார்த்தேன் ரிட்டன் ரிக்வெஸ்ட் ரிஜெக்ட் பண்ணிட்டாங்க. கஸ்டமர் கேருக்கு கேட்டப்போ"" பொருள் எங்களுக்கு வரலை""ன்னு சொல்றாங்க நாலு மாதம் ஆயிடுச்சு. இன்னும் ரீபண்ட் கிடைக்கல இதெல்லாம் என்னப்பா சேவை?
",English,Tamil,F
"Good quality products, delivery always on time.","
சிறந்த குவாலிட்டியான பொருட்கள் சரியான நேரத்தில் டெலிவரி பண்ணுவாங்க
",English,Tamil,F
"From past one week, every now and then while exploring products either the app will go haywire or on clicking any product the white screen will appear and will stay there and nothing will happen when you click back the app will crash and when we try to reopen the same all the search results are disappeared and eventhelast item put into wishlist is also disappeared. The wishlist if exceeds by a certain number leads to a problem where no item can be added in it and it gives error sonethingwent wro","
ஒரு வாரமா பிராடக்ட் பார்க்கும்போது,கிளிக் பண்ணும் போதும், ஆப் முணுமுணுத்துட்டு ஒயிட் ஸ்கிரீன் காட்ட ஆரம்பிக்குது. பேக் அடிச்சா உடனே கிராஷ் ஆயிடுது. திரும்ப ஓபன் பண்ணும் போது எல்லா சர்ச ரிசல்ட் போயிடுது. விஷ்லிஸ்ட்ல  போட்ட ஐட்டம் கூட மறந்திடும்.விஷ்லிஸ்ட்  ஃபுல் ஆனா  ""சம்திங் ராங்""னு எரர் வருது.
",English,Tamil,F
"I updated the app yesterday and since then I don't understand what's going on with the app. It's hanging. It is slow. And I am trying to place an order but it's asking my default address and when I click and proceed on it, its not moving forward. I keep on selecting the default address but it keeps on repeating again and again. I'm not being able to place my order. Honestly, I am irritated and frustrated now. Please fix it.","
நேத்து அப்டேட் பண்ணதுக்கு அப்புறம்,மித்ரா ஆப் பைத்தியம் ஆயிட்டு. ஹாங் ஆகுது, ரொம்ப ஸ்லோவா இருக்குது, ஆர்டர் பிளேஸ் பண்ண ட்ரை பண்றேன்.. டிஃபா. இதை ப்ளீஸ் பிக்ஸ் பண்ணுங்க
",English,Tamil,F
Very good service and easy returns fabulous fantastic 🤩😊,"
ரொம்ப நல்ல சர்வீஸ் ஈஸியா ரிட்டன் பண்ணலாம் அட்டகாசமா இருக்கு🤩😊
",English,Tamil,F
"I have been using this app since years and was happy with the service myntra provides. Recently, i have received a used product without price tag but unfortunately my photos(proofs for myntra feature) are no more valid. I really don't understand then why do this app asks us to return/upload pics/raise concern incase of any issues. DISAPPOINTED! I would rather buy from Nykaa/Amazon which has more or less same products in their application. Bad customer service!!!!!","நான் பல வருஷமா மைய்ந்றா app யூஸ் பண்ணிட்டு இருக்கேன். சேவையோட சந்தோஷமா இருந்தேன். ஆனா இப்ப வந்த product ஓரளவுக்கு யூஸ்ட் பண்ணத மாதிரி இருக்கு, அதுல price tag கூட இல்ல.படங்கள் upload பண்ண சொல்லுறாங்க, ஆனா என் proofs வந்து “valid இல்ல”ன்னு சொல்லுறாங்க. அப்படியென்றா ஏன் photo upload பண்ண சொல்றீங்க? ஏன் concern raise பண்ண சொல்லுறீங்க?ரொம்பவே வருத்தமா இருக்கு. இப்போ நெய்கா இல்லனா அமேசான்ல தான் வாங்குறேன். அதுலயும் இதே மாதிரி products இருக்கே.கேவலம் customer service!",English,Tamil,F
"Worst customer service I have ever experienced. I placed an order on 28th Jan and haven't received the product till date. I have called to register complaints multiple times, still haven't gotten any update, just apologies and assurances that in 24hs I'll get an update. On top of it I am unable to cancel my order and get my cash back. They are unable to give me a reason for that as well. On top of that they are unable to cancel the order from their end as well. I would recommend not use the app.","நான் 28 ஜனவரியில ஒரு ஆர்டர் போட்டேன். இப்ப வரைக்கும் பொருள் வரல. ஏகப்பட்ட தடவை புகார் பண்ணி இருக்கேன். எல்லாமே “24 மணி நேரத்துல பதில் தருறோம்”ன்னு சொல்லி மன்னிப்புதான்.மேலவச்சி, ஆர்டர் ரத்து ஆகல. பணமும் திரும்ப வரல. என்ன காரணம் என்பதையும் சொல்ல தெரியல. தங்களால வேற இந்த ஆர்டரேயே ரத்து பண்ண முடியல.இதுக்காக யாரும் இந்த ஆப்பை யூஸ் பண்ணாதீங்க. ரொம்பவே மோசமா இருக்கு.",English,Tamil,F
Products are as accurate as it is shown but kindly check the product before dispatching to avoid defective product delivery. Also please check the colour difference. Slight colour difference also makes a huge difference. Not so happy with the colour I received sometimes. Good offers. Keep it up.,பொருட்கள் எப்படி காட்டுறாங்களோ அப்படியேதான் வரும். ஆனா அனுப்புறதுக்கு முன்னாடி ஒரு தடவை செக் பண்ணுங்க. சில சமயம் டீபெக்ட் இருக்கும். நிறம் கூட வித்தியாசமா இருக்கும். கொஞ்சம் வித்தியாசம்னாலும் பார்ப்பதுக்கே பெரிய வித்தியாசமாதான் இருக்கும். நிறம் தான் சில சமயம் பிடிக்கல. ஆபர் நல்லா இருக்கு. சப்போர்ட் பண்ணிட்டு போங்க,English,Tamil,F
Terrible service. They don't even have the option to talk to a real customer seevice executive. All I'm getting is the option to find help with the pre-recorded audio. Doesn't matter if I need help with something completely unrelated to information provided on app or that recorded message.,"அசிங்கமான சேவை. நிஜமான கஸ்டமர் கேர் ஏஜெண்ட் கூட பேசுற ஆப்ஷன் இல்ல. ஓடி ஓடி கேட்டாலும் ரெடி செய்யப்பட்ட ஒலி பதிவே தான் கேட்குது. நாம எதுக்காகவேனா ஹெல்ப் கேட்டாலும், அந்த ரெக்கார்டு செய்த தகவல்தான் வருது. பயனில்லாதது!",English,Tamil,F
