src,tgt,src_lang,tgt_lang,domain
"I'm using Myntra from last 3 years and indeed its a very good app for latest fashions and accessories ....bit expensive but worth it... One of the worst thing about Myntra is that if due to some emergency when we need to change the delivery address than it says that ""we don't deliver here"" but in real they do deliver everywhere.... I had to cancel my two orders due to the same problem and i reordered the items from the same address which they denied in the first place...i mean if you don't want to deliver the order to the changed address than what's the use of this option?","நான் கடந்த 3 வருஷமா மின்த்ரா பயன்படுத்திக்கிறேன். நிச்சயமாக இது நவீன ஃபேஷனுக்கான நல்ல ஆப் தான். கொஞ்சம் காசு கூட ஜாஸ்திதான் ஆனா வாங்குறதுக்கு மதிப்பு இருக்கு.ஆனா இதில் ரொம்ப மோசமான விஷயம் என்னனா, அவசரமா delivery address மாற்றணும்னா ""இந்த இடத்துக்கு டெலிவரி செய்ய முடியாது""னு சொல்லும். ஆனா உண்மையில அது எல்லா இடத்துக்கும் டெலிவரி பண்ணும்!நான் 2 ஆர்டர்ஸை இதுக்காக cancel பண்ணி, மறுபடியும் அதே addressலேயே order பண்ணனும் வந்துச்சு.அப்புறம் அந்த address change பண்ணுற ஆப்ஷன் வச்சிருக்குற அர்த்தமே என்ன?",English,Tamil,F
"Having return issue from more than one month. No any support. Tried to contact by call, mail but no any response from them.","ஒரு மாதத்துக்கும் மேலா return பிரச்சனையா இருக்கு. எந்த உதவியும் கிடையாது. phone பண்ணியும், மெயில் அனுப்பியும் முயற்சி பண்ணேன், ஆனா எதுக்கும் பதிலே இல்ல.",English,Tamil,F
"Totally useless website this is. I have ordered a product from myntra. They delivered a wrong product to me and after raising a complaint, they are rejecting my complaint and decline to providing me the solution.","இது ரொம்பவே பயனில்லாத தளம். மின்த்ரால நான் ஒரு பொருள் ஆர்டர் பண்ணேன். ஆனா என்னக்குத் தவறான பொருள்தான் அனுப்பி வைச்சாங்க. கூப்பிட்டு புகார் குடுத்ததும், என் புகாரை நிராகரிச்சு, ஒரு தீர்வும் இல்லன்னு சொல்லிட்டு விட்டாங்க",English,Tamil,F
"Worst online platform with worst customer service ever. For an issue which I had raised for more than a week back, I never get any updates back on that and they simply don't care about the customer experience on their platform at all. If I being an elite customer on the platform, and supposed to get priority customer support is getting this kind of service then I don't know what others will be experiencing. Need Immediate help and attention on the same.","மிகவே மோசமான ஆன்லைன் தளம் இது. கஸ்டமர் கேர் செரியாயே இல்லை. ஒரு வாரத்துக்கு மேலா பிரச்சனை பத்தி புகார் பண்ணிருந்தேன், ஆனா ஒரே ஒரு அப்டேட்டும் வரல. நம்ம வாடிக்கையாளர்கள் எப்படி எப்படின்னு ஒரு கவலையும் இல்ல. நான் Elite user ஆக இருக்கும்போது கூட இப்படி சேவைனா, மற்றவர்களுக்கு எப்படி இருக்குமோ! உடனே உதவி தேவை.",English,Tamil,F
"I am using this app from almost 3 months. so far i wasn't having any problem with the application. But from last week, i am having issue with the app. Issue: I have added few products into my cart, and i changed my mind and thought of buying them later. So wanted to move the items to wishlist, but when i tried to click ""move to wishlist"", none of the items are moving to wishlist. I am getting some error saying ""Something went wrong, try again later"". Kindly help me fix this issues.","நான் இந்த ஆப்பை மூன்று மாதமா யூஸ் பண்றேன். இப்பதான் கடைசி ஒரு வாரமா பிரச்சனை வருது. என்ன பிரச்சனைன்னா – சில பொருள்கள் cartல சேர்த்து வச்சிருந்தேன், ஆனா அப்போ வாங்க வேண்டாம்னு நினைச்சு wishlistக்கு மாற நினைச்சேன். ""Move to wishlist"" கிளிக் பண்ணும்போது எதுவும் மாறலை. “எதோ பிழை நடந்தது, பின்னாடி முயற்சி செய்யவும்”ன்னு  வருது. தயவுசெய்து இதுல உதவி செய்யுங்க",English,Tamil,F
"It ranks ONE in being the most fraudulent site that has ever existed since the dawn of internet. It was successful in cheating me not once ,not twice but 3 times and also the products are absolute counterfeits. I was it's so called ""elite"" customer for 5 years. I loathe it so much that even though I have stopped shopping from it since the past one year, yet when I came across this app again on play store, I couldn't stop from posting this negative but truthful review. The only good thing is...","இன்டர்நெட் ஆரம்பிக்கப்பட்டதுல இருந்து இருக்கிற மோசடி தளங்களுக்கு நம்பர் ஒன்னு இடம் குடுக்கணும்னா இதுக்குத்தான்! என்னை ஒருமுறை இல்ல, மூன்று முறை ஏமாற்றிருக்காங்க. மேலும்னா, வர்ற பொருள்கள் எல்லாம் duplicate தான். நானு 5 வருஷமா  ""Elite"" கஸ்டமரா இருந்தேன். இப்போ இதை பார்க்க கூட வெறுப்பா இருக்கு. ஒரு வருஷமா வாங்கவே இல்ல, ஆனா Play Storeல மீண்டும் பாத்ததும் இந்த உண்மை மெய்யான ரிவ்யூவை எழுதாம இருக்க முடியல. ஒரே ஒரு நல்ல விஷயம் இருந்தா அதுவும்... (நீங்க சொல்லனும் இதுக்கு அடுத்ததா",English,Tamil,F
"Fix the app man! Can't expect a user to keep uninstalling and reinstalling the app in order for it to function properly. I had raised the issue on mail as well, the solution given was amateurish to say the least (clear the cache and uninstall, then reinstall. Lol.) Please fix your application issues and release an updated version of the app in order to avoid losing loyal customers to a plethora of other websites.","அண்ணே, ஆப்பை சரி பண்ணுங்க ! ஒவ்வொரு முறையும் யூசர் uninstall பண்ணி திரும்ப install பண்ணனும் அப்படின்னா அது என்ன சும்மா வேடிக்கையா இருக்கு? Mailல பண்ணிய புகாருக்கு சொன்ன solution-வே கேட்க வைக்குது – “cache clear பண்ணு, uninstall பண்ணி திரும்ப install பண்ணு”னு! . தயவுசெய்து சரியா fix பண்ணி, புதுசா update போடுங்க. இல்லனா நல்லா இருந்து வச்சிருந்த loyal customers-ஐ வேற apps எல்லாத்துக்குமே தூக்கி விட்டுடுவீங்க",English,Tamil,F
Please re-stock the products... it's been almost a year some particular products I am trying to go for are not getting back in stock. No use of Sales and all,"தயவுசெய்து அந்த பொருட்கள் மீண்டும் stockல போடுங்க... கிட்டத்தட்ட ஒரு வருஷமா சில items-ஐ பார்க்குறேன், இன்னும் restock ஆகவே இல்ல. Sale  போடறீங்க, ஆனா வாங்க வேண்டிய பொருளே இல்லனா என்ன பயன்?",English,Tamil,F
"Disappointing experience. No help from myntra when my returned parcel was lost by them. No refund was given. Continuously closing the issue. All is well when you keep buying and things. Zero support when things go wrong, which they do. I have paid for 2 items that were never delivered to me. And that's not okay.","அருவருப்பான அனுபவம். நான் return பண்ணிய parcel-ஐ Myntraதான் தொலைச்சிருக்கு, ஆனா எந்த உதவியும் இல்ல. பணமும் திரும்ப வரல. கேஸ் raise பண்ணினா, ஒரே மாதிரி close பண்ணுறாங்க. வாங்கும் போது எல்லாம் நல்லா தான் நடக்குது, பிரச்சனை வந்தா support தான் zero. இரண்டு பொருள்களுக்கு பணம் கட்டியிருக்கேன் – ஆனா ஒரு விஷயமும் என் கையில் வரல. இது சாதாரண விஷயமா நினைக்க முடியாது",English,Tamil,F
"Really the worst service! I'm a regular customer of this app but the way they cancelled my order due to fault in their delivery process and gave me a poor so called ""goodwill"" coupan (which has so many pre requisite) in place of my coupan (and free delivery) is really disheartening, worst shopping experience ever , i'm in no mood to make any future purchase.","சத்தியமா இது வரையிலான மோசமான சேவையிலே நம்பர் ஒன்னு! நான் ரொம்ப நாளா இந்த ஆப்போட ரெகுலர் கஸ்டமர்  தான். ஆனா இப்போ என் ஆர்டர் கேன்ஸல் பண்ணது, அது கூட தங்களோட டெலிவரி  தவறுக்கு. அதுக்குப்பிறகு கொடுத்தது ஒரு ""goodwill"" கூப்பன் – அதுலயும் ஒரு கோடி நிபந்தனை! என் coupon-ஐயும், free delivery-ஐயும் இழக்க வைத்தாங்க. இதுதான் எனக்கு கடைசி அனுபவம் – இனிமேல் வாங்குற எண்ணமே இல்ல.",English,Tamil,F
Delevery scam happenes so don't pay in advanced.No OTP is taken for verification very worst response team,"Delivery scam நடக்குது, அதனால முன்னாடியே பணம் கொடுக்காதீங்க. OTP எதுவும் கேக்கவே மாட்டாங்க. Response team-னு ஒரு பேருக்கு கூட சம்பந்தமே இல்ல, ரொம்ப மோசமான சேவை",English,Tamil,F
"This is one of those apps which gets worse with every update. Now the return item page doesn't work. In the previous update there was a screen which if you enter, you can't get out. Please take care of ur app quality. Android app is seriously frustrating to use. These kind of bugs should not have reached customers.","இந்த ஆப்பை update பண்ணறதுக்கே பயம் வருது! ஒவ்வொரு update-க்கும் மேல மேல ரொம்பவே கெட்டது ஆகிட்டு இருக்கு. இப்போ return பண்ணுற pageவே work ஆகல. அதுக்கு முன்னாடி ஒரு screenக்கு போனா, வெளியே வரவே முடியாம இருந்துச்சு. இந்த மாதிரியான bugs யூசர் கிட்ட வரவே கூடாது. Android app use பண்ணறதுக்கே கஷ்டமா இருக்கு. App quality-யை தயவுசெய்து சீரியசா  கவனிக்கணும்",English,Tamil,F
I used to prefer buying products from Myntra but my recent experience has forced me to reconsider. I always place prepaid orders because i used to assume Myntra is a reliable site but No! I recently ordered a suit (prepaid). The order didn't get delivered but they are showing the status as delivered. I reached out to customer care who assured me that they will resolve the issue and after 2 days they marked the issue as resolved although the issue is still unresolved. It's testing my patience.,"நான் எப்போமே Myntraல தான் வாங்குவேன், ஆனா இந்த சமீபத்திய அனுபவம் முழுக்க மாறி நினைக்க வைக்குது. நம்பிக்கையோட prepaid ஆர்டர்  பண்ணினேன், ஆனா suit தான் வரவே இல்ல. டெலிவரி statusல வந்துட்டு மாதிரி காட்டறாங்க. Customer careல சொன்னாங்க “சரி பண்ணி தர்றோம்”னு, ஆனா 2 நாள் கழிச்சு “issue resolved”னு முடிச்சுட்டாங்க. பிரச்சனை அப்படியே இருக்கு! இது என் பொறுமையை சோதிக்குது",English,Tamil,F
"Good app in terms of variety of clothes. But worst in terms of how slow the application is. Everytime i click on the notification it takes too long to open the app and once opened the notification related data doesn't load. Instead I get errors like 'page not found', 'cannot load', etc. The app degrades the initial experience of trying to search what I'm looking for as it's very slow to load.","உடைகள் வகைகள் ரொம்ப நல்லா இருக்கு, அதுக்காக தான் இந்த ஆப்பை பயன்படுத்துறேன். ஆனா speed பாத்தா வெறித்தனம்! Notification கிளிக் பண்ணும்போதும் app open ஆகுறதே ரொம்ப நேரம் ஆகுது. Open ஆனாலும், notification க்கு சம்பந்தப்பட்ட page load ஆகவே மாட்டேங்குது – 'page not found', 'cannot load' மாதிரியான errors தான் வரும். எந்த item-ஐ தேடுறதற்கும் ஆரம்பத்திலேயே வருவ அனுபவம் வேற ரொம்ப மோசமா இருக்கு. App லோடிங்க speed நல்லா improve பண்ணனும்.",English,Tamil,F
"Everytime I ordered I got my product as soon as possible and the products are as expected. In any case if I didn't find the product according to me, I easily returned them. So good app with good courier services, the only thing is shipping charges are high, because of it the price of the product become high. So plz do something on this issue . Thank you","எப்போ வாங்கினாலும் பொருள் சீக்கிரமா வந்துருச்சு, நம்பின மாதிரியே இருந்துச்சு. சில சமயம் பிடிக்கலனா எளிமையா திருப்பி அனுப்பிடலாமே. நல்லா வேலை செய்ற ஆப். Courier சேவையும் நல்லா இருக்கு. ஒரே பிரச்சனைனா delivery charges ரொம்ப ஜாஸ்தி. அதனால பொருளோட மொத்த விலை உயர்ந்துருது. இதைத் தீர்க்க என்னாச்சும் பண்ணுங்க. நன்றி!",English,Tamil,F
"I ordered jeans and it got delivered, the length was not proper, it was way too short, i wanted to exchange jeans, the app was laggy, it got clicked on collect insider points and now i am not able to return it. Its a waste of money and product. I requested that dont want those insider points, let me return or exchange the product. They are not allowing it. Bad service. Lost my 1.5k . Atleast the info should be displayed in the return policy. Its a scam","நான் ஜீன்ஸ் வாங்கினேன், வந்ததோட length சரியல்ல, ரொம்ப கமி. Exchange பண்ணலாம்னு try பண்ணேன், ஆனா app சுத்தமா lag ஆகிது. தவறி “insider points வாங்குறது” கிளிக் ஆயிடுச்சு. அதுக்கப்புறம் return பண்ணவே முடியலை. இது பொருளும் பணமும் இரண்டுமே வீணு. நான் clearா சொன்னேன் – points வேண்டாம்னு, product return பண்ண விட்டுருங்கன்னு. ஆனா கேக்கவே இல்ல. 1500 ரூபா போச்சு. குறைந்தது policyலயாவது இதெல்லாம் mention பண்ணிருந்தா எச்சரிக்கையா இருக்கலாமே. இது சுத்தமா ஒரு scam மாதிரி தான்.",English,Tamil,F
"Just like in flipkart, we can change the shipping of the date of the product ...please bring such type of update in myntra also. Otherwise it is best app.",Flipkart மாதிரி shipping date-ஐ நாமே மாற்றலாம் மாதிரி option Myntraலயும் கொண்டு வருங்க. இல்லனா அது மட்டந்தான் ஒரு miss ஆகிருக்கு. வேற எல்லாமே super app தான்!,English,Tamil,F
"Recently had a horrid experience when I ordered a pair of leggings and when the product was received I found it was of August 2019. I had fitting issues so raised a return request. The status was falsely marked as pick up attempt failed twice. Today I have raised the request third time. No support from customer care or pick up agent , they are a complete waste of time. Is it a way of dumping old stock? I'm apprehensive about what will be the status update for today. I'm done with Myntra.","இப்பதான் ஒரு மோசமான அனுபவம் நடந்துச்சு. லெகின்ஸ் வாங்கினேன், வந்த product August 2019ல பதியப்பட்டது. Size சரியில்ல, அதனால return request போட்டேன். ஆனா இரண்டு தடவையும் “pickup attempt failed”னு பொய் status போட்டுருக்காங்க. இன்றும் மூன்றாவது தடவை request போட்டேன். Customer careலிருந்தும், pickup agentலிருந்தும் எந்த உதவியும் இல்ல. Time waste தான். பழைய stock-ஐ இப்படி தூக்கி விக்குறதுக்கா இந்தச் செயல்? இன்றைய statusயும் என்ன ஆகுமோனு சந்தேகம் தான். எனக்கு Myntra-வோட சாப்பிங் முற்றிலும் முடிஞ்சு.",English,Tamil,F
it is very easy to shop on this app and also it is super easy to return,இந்த ஆப்ல ஷாப் பண்ணுறதும் ஈஸி ரிட்டன் பண்ணுறதும் ஈசி,English,Tamil,F
shows lower price but charges more during the bill,ஆப்பில காட்டும் போது குறைச்ச விலையில காட்டுறாங்க ஆனா பில் போடும்போது அதிக விலை வருது.,English,Tamil,F
"Expensive and complicated returns. The app filters are not working. The returns are complicated. They send you incorrect product and then reject your return unnecessarily making you wait and talk to their customer executive, who have no clue of what they are saying. Refunds don't come back to your accounts on time. The app layout is also very bad, you have to select filters everytime you want to do a search. Products are not worth the money. I am going to stop using it.","செலவு ஜாஸ்தி, ரிட்டர்ன் செய்யலாம்னு வேற சிக்கலா இருக்கு. ஆப்புல இருக்குற ஃபில்டர்ஸ் கூட சரியா வேலை செய்யல. தவறான பொருள் அனுப்பிட்டு, ரிட்டர்ன் கேப்போ return ஏற்றுக்க மாட்டேங்க, வாடிக்கையாளர் சேவை கேட்பீங்கனா அவர்களுக்கே தெரியாது என்ன சொல்றதுனு. பணம் திருப்பி வரதுக்கும் டைம் பண்ணிட்டு தான் வரும். ஆப்போட லேஅவுட் கூட கஷ்டமா இருக்கு – ஒவ்வொரு முறையும் ஃபில்டர் போட்டுதான் தேடணும். பொருட்கள் வேற அந்தளவுக்கு மதிப்போ இல்ல. நா இப்போ இந்த ஆப்பை விட்டுரப்போறேன்",English,Tamil,F
I have placed a order from this site and I got defective product. Raised the concern with customer care and they are unable to help. The product is amended very smartly and delivered. When I explained they got my point that means I am not the first person who faced this issue with this product. They don't do supplier background checks. Anybody can sell their product and fool the customers. Didn't expected this kind of customer services.,"இந்த தளத்துல ஒரு பொருள் ஆர்டர் பண்ணேன். வந்ததோ ஒரு பழைய  பொருள். கஸ்டமர் கேர் கிட்ட சொன்னேனா, உதவி பண்ணவே இல்ல. பொருள் வேற ரொம்ப சாமர்த்தியமா சரி பண்ணி அனுப்பிய மாதிரி. நான் சொன்னத சொல்லியதும், அவர்களுக்கே புரிஞ்சுது – அதே பொருள்ல முன்னாடியும் யாராவதும் இதே பிரச்சனை பண்ணிருப்பாங்க போல. அவர்கள் வேற எந்த supplier-ஐயும் சரியா background check பண்ணவே இல்ல. யார வேண்டுமானாலும் பொருள் விக்கலாம், வாடிக்கையாளர் தப்பி போறாங்க. இப்படிப்பட்ட சேவை கிடைக்கும் என்ன நினைச்சவே இல்ல",English,Tamil,F
